{
  "siteTitle": "卓越實戰營學習地圖",
  "siteSubtitle": "從學習課程，到事業實戰",
  "version": "第一版規劃稿",
  "contentPolicy": {
    "originalCourseNames": "依使用者提供的課程名稱保留；不擅自改寫為其他正式名稱。",
    "suggestedContent": "學習目的、預期能力、應用情境、練習與自我檢核目前均為網站建議補充，需由課程負責人依正式教材審閱確認。",
    "duplicateNote": "原始三階清單中「組織運作與團隊管理」重複列出一次；網站總覽以一個課程項目呈現，避免重複顯示，未改動課程名稱。"
  },
  "categories": [
    "事業認知與經營心態",
    "產品知識與專業服務",
    "表達、見證與銷售",
    "客戶開發與邀約",
    "事業運作與服務系統",
    "組織運作與團隊管理"
  ],
  "applicationPaths": [
    {
      "id": "sales",
      "label": "銷售與客戶溝通",
      "description": "從產品理解、表達、見證到客戶服務。"
    },
    {
      "id": "market",
      "label": "市場開發與邀約",
      "description": "從名單、邀約、初次互動到陌生開發。"
    },
    {
      "id": "service",
      "label": "客戶服務與持續經營",
      "description": "從產品維護、體驗服務到持續追蹤。"
    },
    {
      "id": "organization",
      "label": "組織發展與團隊管理",
      "description": "從個人能力、示範演練到團隊帶領。"
    }
  ],
  "courses": [
    {
      "id": "L1-01",
      "stage": "一階",
      "stageLabel": "LEVEL 01 · 基礎建立",
      "title": "認識事業及應具備的能力",
      "category": "事業認知與經營心態",
      "skills": [
        "事業認知",
        "經營心態"
      ],
      "sourceStatus": "依學習網站去品牌化需求調整標題；其餘課程名稱依提供清單保留。",
      "learningPurpose": {
        "status": "建議補充",
        "text": "協助學員理解事業的基本架構，並盤點投入事業經營所需的基礎能力。"
      },
      "expectedAbility": {
        "status": "建議補充",
        "text": "建議學員能說明自己對事業的理解，並列出需要持續練習的能力。"
      },
      "applications": {
        "sales": {
          "status": "建議補充",
          "text": "建議用於初次事業介紹前的準備，先釐清自身角色與可提供的價值。"
        },
        "market": {
          "status": "建議補充",
          "text": "建議用於整理目標客群、初次接觸前的準備與邀約方向。"
        },
        "organization": {
          "status": "建議補充",
          "text": "建議帶領夥伴盤點能力差距，協助新夥伴安排後續學習順序。"
        }
      },
      "practice": {
        "status": "建議補充",
        "text": "建議依本堂課的正式教材設計一次實作練習，並由講師或夥伴提供具體回饋。"
      },
      "selfCheck": {
        "status": "建議補充",
        "items": [
          "我能說明這堂課的核心重點",
          "我能在實際情境中示範這項能力",
          "我知道遇到困難時可以如何複習與改善"
        ]
      },
      "relatedCourses": [],
      "notes": []
    },
    {
      "id": "L1-02",
      "stage": "一階",
      "stageLabel": "LEVEL 01 · 基礎建立",
      "title": "事業經營的正確觀念與態度",
      "category": "事業認知與經營心態",
      "skills": [
        "經營觀念",
        "持續行動"
      ],
      "sourceStatus": "原始課程名稱：使用者提供",
      "learningPurpose": {
        "status": "建議補充",
        "text": "協助學員建立對事業經營的基本認知與持續學習的態度。"
      },
      "expectedAbility": {
        "status": "建議補充",
        "text": "建議學員能說出自己的經營目標，並規劃可執行的日常行動。"
      },
      "applications": {
        "sales": {
          "status": "建議補充",
          "text": "建議將正確觀念落實在誠實介紹、理解需求與持續服務上。"
        },
        "market": {
          "status": "建議補充",
          "text": "建議以固定的名單整理、邀約與追蹤節奏，避免只憑一時熱情行動。"
        },
        "organization": {
          "status": "建議補充",
          "text": "建議主管以身作則，陪伴夥伴建立穩定且可持續的行動習慣。"
        }
      },
      "practice": {
        "status": "建議補充",
        "text": "建議依本堂課的正式教材設計一次實作練習，並由講師或夥伴提供具體回饋。"
      },
      "selfCheck": {
        "status": "建議補充",
        "items": [
          "我能說明這堂課的核心重點",
          "我能在實際情境中示範這項能力",
          "我知道遇到困難時可以如何複習與改善"
        ]
      },
      "relatedCourses": [],
      "notes": []
    },
    {
      "id": "L1-03",
      "stage": "一階",
      "stageLabel": "LEVEL 01 · 基礎建立",
      "title": "三分鐘自我介紹",
      "category": "表達、見證與銷售",
      "skills": [
        "自我介紹",
        "表達溝通"
      ],
      "sourceStatus": "原始課程名稱：使用者提供",
      "learningPurpose": {
        "status": "建議補充",
        "text": "練習在有限時間內，清楚介紹自己與建立初步連結。"
      },
      "expectedAbility": {
        "status": "建議補充",
        "text": "建議學員能完成一段簡潔、有重點且自然的自我介紹。"
      },
      "applications": {
        "sales": {
          "status": "建議補充",
          "text": "建議用於初次見面、客戶交流或產品介紹前的暖身。"
        },
        "market": {
          "status": "建議補充",
          "text": "建議用於陌生接觸、活動交流與邀約前的第一段對話。"
        },
        "organization": {
          "status": "建議補充",
          "text": "建議作為新夥伴的基礎演練項目，透過回饋持續修正。"
        }
      },
      "practice": {
        "status": "建議補充",
        "text": "建議依本堂課的正式教材設計一次實作練習，並由講師或夥伴提供具體回饋。"
      },
      "selfCheck": {
        "status": "建議補充",
        "items": [
          "我能說明這堂課的核心重點",
          "我能在實際情境中示範這項能力",
          "我知道遇到困難時可以如何複習與改善"
        ]
      },
      "relatedCourses": [],
      "notes": []
    },
    {
      "id": "L1-04",
      "stage": "一階",
      "stageLabel": "LEVEL 01 · 基礎建立",
      "title": "三分鐘產品介紹",
      "category": "表達、見證與銷售",
      "skills": [
        "產品介紹",
        "表達溝通"
      ],
      "sourceStatus": "原始課程名稱：使用者提供",
      "learningPurpose": {
        "status": "建議補充",
        "text": "練習在有限時間內清楚介紹產品資訊，開啟後續溝通。"
      },
      "expectedAbility": {
        "status": "建議補充",
        "text": "建議學員能有條理地介紹產品，並依對方反應調整說明方式。"
      },
      "applications": {
        "sales": {
          "status": "建議補充",
          "text": "建議用於產品介紹、客戶諮詢與體驗前說明；具體產品資訊應以正式教材為準。"
        },
        "market": {
          "status": "建議補充",
          "text": "建議用於新客戶初次接觸後的產品說明，作為後續邀約或體驗的起點。"
        },
        "organization": {
          "status": "建議補充",
          "text": "建議示範給新夥伴並安排短講演練，建立團隊一致的基本表達能力。"
        }
      },
      "practice": {
        "status": "建議補充",
        "text": "建議依本堂課的正式教材設計一次實作練習，並由講師或夥伴提供具體回饋。"
      },
      "selfCheck": {
        "status": "建議補充",
        "items": [
          "我能說明這堂課的核心重點",
          "我能在實際情境中示範這項能力",
          "我知道遇到困難時可以如何複習與改善"
        ]
      },
      "relatedCourses": [],
      "notes": []
    },
    {
      "id": "L1-05",
      "stage": "一階",
      "stageLabel": "LEVEL 01 · 基礎建立",
      "title": "邀約與列名單",
      "category": "客戶開發與邀約",
      "skills": [
        "名單整理",
        "邀約"
      ],
      "sourceStatus": "原始課程名稱：使用者提供",
      "learningPurpose": {
        "status": "建議補充",
        "text": "建立可持續執行的名單整理與邀約習慣。"
      },
      "expectedAbility": {
        "status": "建議補充",
        "text": "建議學員能整理潛在互動對象，並設計自然、清楚的邀約方式。"
      },
      "applications": {
        "sales": {
          "status": "建議補充",
          "text": "建議用於安排產品說明、體驗或後續客戶交流。"
        },
        "market": {
          "status": "建議補充",
          "text": "建議用於拓展人際接觸、規劃邀約順序及記錄後續跟進。"
        },
        "organization": {
          "status": "建議補充",
          "text": "建議帶領夥伴定期檢視邀約行動與經驗，提供具體回饋。"
        }
      },
      "practice": {
        "status": "建議補充",
        "text": "建議依本堂課的正式教材設計一次實作練習，並由講師或夥伴提供具體回饋。"
      },
      "selfCheck": {
        "status": "建議補充",
        "items": [
          "我能說明這堂課的核心重點",
          "我能在實際情境中示範這項能力",
          "我知道遇到困難時可以如何複習與改善"
        ]
      },
      "relatedCourses": [],
      "notes": []
    },
    {
      "id": "L1-06",
      "stage": "一階",
      "stageLabel": "LEVEL 01 · 基礎建立",
      "title": "抗菌系列產品與銷售話術",
      "category": "產品知識與專業服務",
      "skills": [
        "產品知識",
        "銷售表達"
      ],
      "sourceStatus": "原始課程名稱：使用者提供",
      "learningPurpose": {
        "status": "建議補充",
        "text": "熟悉抗菌系列產品的正式資訊，練習以清楚、負責任的方式介紹產品。"
      },
      "expectedAbility": {
        "status": "建議補充",
        "text": "建議學員能依正式產品資料說明特色，避免誇大或未經證實的功效宣稱。"
      },
      "applications": {
        "sales": {
          "status": "建議補充",
          "text": "建議用於產品介紹與客戶疑問回應，所有產品說明以核准資料及正式教材為準。"
        },
        "market": {
          "status": "建議補充",
          "text": "建議用於開發客戶時的產品溝通，先了解需求再選擇適切資訊。"
        },
        "organization": {
          "status": "建議補充",
          "text": "建議以正式教材作為團隊練習依據，統一資訊並持續修正話術。"
        }
      },
      "practice": {
        "status": "建議補充",
        "text": "建議依本堂課的正式教材設計一次實作練習，並由講師或夥伴提供具體回饋。"
      },
      "selfCheck": {
        "status": "建議補充",
        "items": [
          "我能說明這堂課的核心重點",
          "我能在實際情境中示範這項能力",
          "我知道遇到困難時可以如何複習與改善"
        ]
      },
      "relatedCourses": [],
      "notes": []
    },
    {
      "id": "L1-07",
      "stage": "一階",
      "stageLabel": "LEVEL 01 · 基礎建立",
      "title": "產品維護及管理",
      "category": "產品知識與專業服務",
      "skills": [
        "產品維護",
        "客戶服務"
      ],
      "sourceStatus": "原始課程名稱：使用者提供",
      "learningPurpose": {
        "status": "建議補充",
        "text": "了解產品維護與管理的重要性，建立清楚的產品使用及照護溝通習慣。"
      },
      "expectedAbility": {
        "status": "建議補充",
        "text": "建議學員能依正式產品說明提供適當的維護資訊。"
      },
      "applications": {
        "sales": {
          "status": "建議補充",
          "text": "建議用於成交後的產品說明與服務；實際指引以產品標示及正式教材為準。"
        },
        "market": {
          "status": "建議補充",
          "text": "建議作為持續服務與客戶關係維護的一部分。"
        },
        "organization": {
          "status": "建議補充",
          "text": "建議整理常見問題與正式回答，協助團隊提供一致的服務資訊。"
        }
      },
      "practice": {
        "status": "建議補充",
        "text": "建議依本堂課的正式教材設計一次實作練習，並由講師或夥伴提供具體回饋。"
      },
      "selfCheck": {
        "status": "建議補充",
        "items": [
          "我能說明這堂課的核心重點",
          "我能在實際情境中示範這項能力",
          "我知道遇到困難時可以如何複習與改善"
        ]
      },
      "relatedCourses": [],
      "notes": []
    },
    {
      "id": "L2-01",
      "stage": "二階",
      "stageLabel": "LEVEL 02 · 實戰提升",
      "title": "相信的力量",
      "category": "事業認知與經營心態",
      "skills": [
        "信念",
        "溝通"
      ],
      "sourceStatus": "原始課程名稱：使用者提供",
      "learningPurpose": {
        "status": "建議補充",
        "text": "引導學員理解信念與行動之間的關係，並反思自己如何傳達信任。"
      },
      "expectedAbility": {
        "status": "建議補充",
        "text": "建議學員能辨識自己的信念如何影響表達與行動。"
      },
      "applications": {
        "sales": {
          "status": "建議補充",
          "text": "建議在銷售溝通中以真誠、尊重與實際資訊建立信任。"
        },
        "market": {
          "status": "建議補充",
          "text": "建議在市場互動中先建立關係，不以強迫方式要求對方接受。"
        },
        "organization": {
          "status": "建議補充",
          "text": "建議主管透過傾聽與示範，陪伴夥伴建立信心與行動意願。"
        }
      },
      "practice": {
        "status": "建議補充",
        "text": "建議依本堂課的正式教材設計一次實作練習，並由講師或夥伴提供具體回饋。"
      },
      "selfCheck": {
        "status": "建議補充",
        "items": [
          "我能說明這堂課的核心重點",
          "我能在實際情境中示範這項能力",
          "我知道遇到困難時可以如何複習與改善"